{
  "protocol_version": "runtime-contract.v1",
  "schema_version": "execution-result.v1",
  "document_type": "execution-result",
  "run_id": "RUN-001",
  "request_hash": "sha256:70d377068f5fe9a7031876978a1092aee6b8548b2dc35a300eb79475e7734f37",
  "journal_head": {
    "sequence": 1,
    "run_revision": 1,
    "event_hash": "sha256:a1b5799365ea584a6970f016b93e21fea5a7002fbee0ac783979673b95d041d8"
  },
  "status": "COMPLETED",
  "finished_at": "2026-08-19T00:01:00.000Z",
  "outputs": [
    {
      "document_type": "implementation-output",
      "artifact_id": "OUTPUT-001",
      "revision": 1,
      "hash": "sha256:1212121212121212121212121212121212121212121212121212121212121212"
    }
  ],
  "error": null,
  "usage": {
    "input_tokens": 1000,
    "output_tokens": 250,
    "cost_microusd": 120000,
    "duration_ms": 60000,
    "turns": 2
  },
  "evidence": [
    {
      "document_type": "execution-evidence",
      "artifact_id": "EVIDENCE-001",
      "revision": 1,
      "hash": "sha256:1313131313131313131313131313131313131313131313131313131313131313"
    }
  ],
  "trace": {
    "trace_id": "0123456789abcdef0123456789abcdef",
    "span_id": "0123456789abcdef",
    "trace_flags": 1
  }
}
